price,product_description,product_id,product_name
615,Science prove hair include.,0,productTracy Weber
211,Receive station analysis front.,1,productDeanna Robinson
581,Short garden hold people.,2,productMarie Underwood
996,Piece address adult exactly hotel.,3,productMark Thompson
684,State ability nation east.,4,productAnna Clark
911,Serve ready change themselves.,5,productAmy Barr
692,Personal billion information table as.,6,productLaura Jones
531,Anything hour ever baby.,7,productBeverly Dominguez
391,Executive least guy turn.,8,productBrandon Cortez
415,Suggest cover wall necessary point.,9,productDeanna Barrett
464,But save positive lose a fly.,10,productJames Ward
913,Treatment car behavior evidence.,11,productCaleb Clark
534,Available scientist somebody material.,12,productDonna Moore
417,Help near behind.,13,productTroy Montes
725,Nature tend leave. Church budget think.,14,productCheryl Prince
135,Always fund specific light dark.,15,productAshley Pena
438,Provide continue newspaper likely good.,16,productDaniel Bauer
341,Effort rich heavy ready three.,17,productMatthew Ortega
612,Culture commercial deal true.,18,productAmber Bowman
860,Without almost though have.,19,productElizabeth Fowler
940,City ready effort position.,20,productSarah Peterson
506,Low do field method mission.,21,productBlake Forbes
286,Many those both purpose.,22,productLisa Powell
903,Position budget member.,23,productSarah Rose
294,South remain blue eye hospital.,24,productKristen Jefferson
258,Keep table election.,25,productMonique Velazquez
723,Animal instead before source.,26,productMelissa Armstrong
586,Whole care water rise common.,27,productBrittany Gill
234,Front instead argue act.,28,productKimberly Pearson
597,Bill individual attention heart.,29,productGeoffrey Swanson
347,Sound budget anyone wear.,30,productAaron Santiago
112,Seat three friend high focus list.,31,productMarcus Ray
268,Eye letter threat name.,32,productShannon Anderson
210,Exactly number pattern whose.,33,productKristen Smith
372,Their join soon develop number.,34,productRichard Johnson
603,Kind during whose finish store.,35,productJeremy Flores
589,Tonight believe nation start wide.,36,productDarren Lopez
494,Common guess rate without.,37,productGrace Smith
901,Doctor throughout evening her receive.,38,productSteven Patrick
836,Enough grow ball go.,39,productChristina Davis
128,Wrong heavy pass board among him.,40,productTimothy Wilkerson
407,Know movie receive customer.,41,productSteven Bauer
108,Usually language military.,42,productJennifer Calhoun
813,Generation also out board simply.,43,productRobert Christian
759,Step number ball.,44,productTodd Holmes
654,Offer economic research.,45,productScott Chavez
383,Finally here stage plan.,46,productJennifer Peterson
142,Seem theory month.,47,productTheodore Shields
977,Win important turn fact might note.,48,productJimmy Morris
158,What detail brother same.,49,productGabriella Hartman
